<?xml version="1.0" encoding="UTF-8"?>
<!DOCTYPE videoclub SYSTEM "videoclub.dtd">
<videoclub direccion="Parque Europa" nombre="El Perro Loco" telefono="957525112">
    <peliculas> 
        <pelicula codigoPelicula="pel001" coste="5"> 
            <titulo>La milla verde</titulo>
            <genero>Drama/Crimen</genero>
            <estreno/>
            <disponible/>
        </pelicula>
        <pelicula codigoPelicula="pel033">
            <titulo></titulo>
            <genero></genero>
            <alquilada/>
        </pelicula> 
    </peliculas>
    <juegos>
        <juego>FC 24 &top;</juego>
        <disponible/>
    </juegos>
</videoclub>